{"accounting_policy":{"artifact_id":"accounting_policy","relative_path":"inputs/accounting_policy.json","sha256":"684c4ada09cc992e12fde122a77a42ffaf86039d44c856a061c9e972f570e2f5","size_bytes":420},"authority_policy":{"artifact_id":"authority_policy","relative_path":"inputs/authority_policy.json","sha256":"76f053820878319d4ee5dfa6ee1f1cffc1776787256518ed166a21a36f87aeb3","size_bytes":342},"evaluation_policy":{"artifact_id":"evaluation_policy","relative_path":"inputs/evaluation_policy.json","sha256":"8443afad53a347663a640fb169c03e4077ce94023ed756944c7b717995a8c701","size_bytes":481},"execution_policy":{"artifact_id":"execution_policy","relative_path":"inputs/execution_policy.json","sha256":"12959cc4457b69633822bad7b01302e596fbca5fa09246fbc85ed5f01cb052c9","size_bytes":623},"instrument_registry":{"artifact_id":"instrument_registry","relative_path":"inputs/instrument_registry.json","sha256":"8613981486a1813cbf780aef46598ac5879a9860d63e5ed1d5f347a7cdf2a83b","size_bytes":215},"inventory_policy":{"artifact_id":"inventory_policy","relative_path":"inputs/inventory_policy.json","sha256":"7c71d8abe66fae3c466af163af93deecf56cf151debb329683dfd6df32f5caf3","size_bytes":330},"output_directory":"oracle_output","proposal":{"artifact_id":"proposal","relative_path":"inputs/proposal.json","sha256":"11d4be092b3fb49f523f434b99c2b549a235c58e596bff697fc2c91dfa5d56e8","size_bytes":1099},"schema_version":2,"source_blob":{"artifact_id":"source_blob","relative_path":"inputs/source_blob.jsonl","sha256":"7c2452f81c3b44995529b494a1921c306593474c84b006c75c0c722ee2160b70","size_bytes":796},"source_manifest":{"artifact_id":"source_manifest","relative_path":"inputs/source_manifest.json","sha256":"4dff5e7a10f4c42cfa793d8402e7fa23dd91ec3cd24933f211b7074dad05c963","size_bytes":677}}
